"asin","product_title","average_rating","total_reviews","review_author","author_badge","badge","reviewed_product_attribute","reviewed_variant_asin","variant_review_url","review_rating","review_date","reviewed_country","review_text","review_comment_count","review_header","no_of_people_reacted_helpful","author_profile_url","url","brand","review_url","input"
"B095322ZW8","Nomadland (4K UHD)","4.3","866","Amazon Customer","","Verified Purchase","","","","5.0","March 23, 2022","United States","The acting storyline just was 🥰phenomenal.","","What a very intense great story.","","https://www.amazon.com/gp/profile/amzn1.account.AHOFLI25A2PW27D7V2YTQWM4PAYA/ref=cm_cr_arp_d_gw_btm?ie=UTF8","https://www.amazon.com/product-reviews/B095322ZW8/ref=cm_cr_arp_d_viewopt_sr?ie=UTF8&pageNumber=12&filterByStar=all_stars&sortBy=helpful&reviewerType=all_reviews","Frances McDormand","https://www.amazon.com/gp/customer-reviews/R2T3SGYR4Z56S4/ref=cm_cr_arp_d_rvw_ttl?ie=UTF8&ASIN=B095322ZW8","https://www.amazon.com/-/en/Frances-McDormand/dp/B095322ZW8/ref=sr_1_4?keywords=nomadland&qid=1664326384&qu=eyJxc2MiOiIyLjQ3IiwicXNhIjoiMi43MSIsInFzcCI6IjEuMjAifQ%3D%3D&sprefix=Nomadla%2Caps%2C285&sr=8-4"
"B095322ZW8","Nomadland (4K UHD)","4.3","866","horselover","","","","","","2.0","May 01, 2021","United States","Read the book instead. The only thing somewhat positive about this poor adaptation of a wonderful book is the real people. The story is very disjointed, does little to really represent the nomads lives. Fern comes off as almost juvenile and ditzy. So much wasted time in this movie.","","Read the book instead.","1","https://www.amazon.com/gp/profile/amzn1.account.AFENR5X4XGWBFHLV7FRB4QNRNU6Q/ref=cm_cr_arp_d_gw_btm?ie=UTF8","https://www.amazon.com/product-reviews/B095322ZW8/ref=cm_cr_arp_d_viewopt_sr?ie=UTF8&pageNumber=75&filterByStar=all_stars&sortBy=helpful&reviewerType=all_reviews","Frances McDormand","https://www.amazon.com/gp/customer-reviews/R2984QS5WKG7PZ/ref=cm_cr_arp_d_rvw_ttl?ie=UTF8&ASIN=B095322ZW8","https://www.amazon.com/-/en/Frances-McDormand/dp/B095322ZW8/ref=sr_1_4?keywords=nomadland&qid=1664326384&qu=eyJxc2MiOiIyLjQ3IiwicXNhIjoiMi43MSIsInFzcCI6IjEuMjAifQ%3D%3D&sprefix=Nomadla%2Caps%2C285&sr=8-4"
"B095322ZW8","Nomadland (4K UHD)","4.3","866","wolfwien1020","","Verified Purchase","","","","5.0","October 06, 2021","Germany 🇩🇪","top film !!!","","bester oscarfilm des jahres 2021","","","https://www.amazon.com/product-reviews/B095322ZW8/ref=cm_cr_arp_d_viewopt_sr?ie=UTF8&pageNumber=86&filterByStar=all_stars&sortBy=helpful&reviewerType=all_reviews","Frances McDormand","","https://www.amazon.com/-/en/Frances-McDormand/dp/B095322ZW8/ref=sr_1_4?keywords=nomadland&qid=1664326384&qu=eyJxc2MiOiIyLjQ3IiwicXNhIjoiMi43MSIsInFzcCI6IjEuMjAifQ%3D%3D&sprefix=Nomadla%2Caps%2C285&sr=8-4"
"B095322ZW8","Nomadland (4K UHD)","4.3","866","frederick matt","","Verified Purchase","","","","1.0","May 17, 2021","United States","sorry i wasted my 6 bucks...sure..great acting and scenery,but the movie sucked and depressed me.Why make a movie like this? How exciting..homeless ,disfunctional people shitting in pails and living disgustingly. I don't get it ....I want my 6 bucks back or credit to see entertaining movies. I don't get the statement this movie is trying to make.","","very boring and depressing","1","https://www.amazon.com/gp/profile/amzn1.account.AEM3L3G3LKHA2VVCMUAHAFN3UA4Q/ref=cm_cr_arp_d_gw_btm?ie=UTF8","https://www.amazon.com/product-reviews/B095322ZW8/ref=cm_cr_arp_d_viewopt_sr?ie=UTF8&pageNumber=55&filterByStar=all_stars&sortBy=helpful&reviewerType=all_reviews","Frances McDormand","https://www.amazon.com/gp/customer-reviews/R5SAAGLNYGM6O/ref=cm_cr_arp_d_rvw_ttl?ie=UTF8&ASIN=B095322ZW8","https://www.amazon.com/-/en/Frances-McDormand/dp/B095322ZW8/ref=sr_1_4?keywords=nomadland&qid=1664326384&qu=eyJxc2MiOiIyLjQ3IiwicXNhIjoiMi43MSIsInFzcCI6IjEuMjAifQ%3D%3D&sprefix=Nomadla%2Caps%2C285&sr=8-4"
"B095322ZW8","Nomadland (4K UHD)","4.3","866","Will","","Verified Purchase","","","","5.0","May 25, 2021","United States 🇺🇸","Don't watch this movie if you're depressed or having money problems. It is a sad commentary on that segment of the population who are too poor to afford a real home, and live as nomads in campers or vans, traveling as itinerant workers for places like Amazon during Christmas. They are, as the protagonist says, are ""houseless, not homeless"". It was a brilliantly written movie and the acting is superb, but the topic is depressing and dark. Still, this movie needed to be made to shed light on an invisible people.","","Great movie, but dark","2","https://www.amazon.com/gp/profile/amzn1.account.AEA2WW3SB56PEN3PJJVOP6T33LRA/ref=cm_cr_arp_d_gw_btm?ie=UTF8","https://www.amazon.com/product-reviews/B095322ZW8/ref=cm_cr_arp_d_viewopt_sr?ie=UTF8&pageNumber=10&filterByStar=all_stars&sortBy=helpful&reviewerType=all_reviews","Frances McDormand","https://www.amazon.com/gp/customer-reviews/R2TNPT9PUZT5E3/ref=cm_cr_arp_d_rvw_ttl?ie=UTF8&ASIN=B095322ZW8","https://www.amazon.com/-/en/Frances-McDormand/dp/B095322ZW8/ref=sr_1_4?keywords=nomadland&qid=1664326384&qu=eyJxc2MiOiIyLjQ3IiwicXNhIjoiMi43MSIsInFzcCI6IjEuMjAifQ%3D%3D&sprefix=Nomadla%2Caps%2C285&sr=8-4"
"B095322ZW8","Nomadland (4K UHD)","4.3","866","Emma Lou","","","","","","1.0","May 28, 2021","United States","I watch movies for entertainment. This was boring and dragged out. Kept thinking it has to get better. It never did.","","Can't believe this won an Oscar?!","","https://www.amazon.com/gp/profile/amzn1.account.AHT4MAJGCUU25OZU2INXJHWBKN5Q/ref=cm_cr_arp_d_gw_btm?ie=UTF8","https://www.amazon.com/product-reviews/B095322ZW8/ref=cm_cr_arp_d_viewopt_sr?ie=UTF8&pageNumber=77&filterByStar=all_stars&sortBy=helpful&reviewerType=all_reviews","Frances McDormand","https://www.amazon.com/gp/customer-reviews/R1LMAKSA1DUEYS/ref=cm_cr_arp_d_rvw_ttl?ie=UTF8&ASIN=B095322ZW8","https://www.amazon.com/-/en/Frances-McDormand/dp/B095322ZW8/ref=sr_1_4?keywords=nomadland&qid=1664326384&qu=eyJxc2MiOiIyLjQ3IiwicXNhIjoiMi43MSIsInFzcCI6IjEuMjAifQ%3D%3D&sprefix=Nomadla%2Caps%2C285&sr=8-4"
"B095322ZW8","Nomadland (4K UHD)","4.3","866","Arctic Moon Beam","","Verified Purchase","","","","5.0","July 11, 2021","United States 🇺🇸","Wonderful story telling.","","So good!","","https://www.amazon.com/gp/profile/amzn1.account.AH2XLJY3NBDNQYW73QFYA773QR5A/ref=cm_cr_arp_d_gw_btm?ie=UTF8","https://www.amazon.com/product-reviews/B095322ZW8/ref=cm_cr_arp_d_viewopt_sr?ie=UTF8&pageNumber=45&filterByStar=all_stars&sortBy=helpful&reviewerType=all_reviews","Frances McDormand","https://www.amazon.com/gp/customer-reviews/R2LAWPZ0EN5BO4/ref=cm_cr_arp_d_rvw_ttl?ie=UTF8&ASIN=B095322ZW8","https://www.amazon.com/-/en/Frances-McDormand/dp/B095322ZW8/ref=sr_1_4?keywords=nomadland&qid=1664326384&qu=eyJxc2MiOiIyLjQ3IiwicXNhIjoiMi43MSIsInFzcCI6IjEuMjAifQ%3D%3D&sprefix=Nomadla%2Caps%2C285&sr=8-4"
"B095322ZW8","Nomadland (4K UHD)","4.3","866","Paige","","","","","","5.0","April 13, 2021","United States","Beautiful film about the struggles of people to survive who have little income and yearn for both freedom and survival in the America of today. Not all people fit in to the little boxes that America has said we need to do to be successful. Especially in the time of pandemic with job losses and not being able to pay the bills. This is an alternative that some people have to do to survive and some choose to do for their mental health. I have seen this movie many times and when it comes to the theatre near me on April 24th I will enjoy seeing it on the big screen for the beautiful scenery. This inspires me to get on the road and I have learned a lot from the film and the Rubber Tramp Rodeo and the Homes on Wheels Alliance and Nomads helping Nomads. This is a lesson in humanity supporting others to survive.","","A Lesson for Life!","5","https://www.amazon.com/gp/profile/amzn1.account.AECUP5GSBRDFG534OQ3B536E3Y3Q/ref=cm_cr_arp_d_gw_btm?ie=UTF8","https://www.amazon.com/product-reviews/B095322ZW8/ref=cm_cr_arp_d_viewopt_sr?ie=UTF8&pageNumber=79&filterByStar=all_stars&sortBy=helpful&reviewerType=all_reviews","Frances McDormand","https://www.amazon.com/gp/customer-reviews/R12W0M81OQ0KJ/ref=cm_cr_arp_d_rvw_ttl?ie=UTF8&ASIN=B095322ZW8","https://www.amazon.com/-/en/Frances-McDormand/dp/B095322ZW8/ref=sr_1_4?keywords=nomadland&qid=1664326384&qu=eyJxc2MiOiIyLjQ3IiwicXNhIjoiMi43MSIsInFzcCI6IjEuMjAifQ%3D%3D&sprefix=Nomadla%2Caps%2C285&sr=8-4"
"B095322ZW8","Nomadland (4K UHD)","4.3","866","David","","Verified Purchase","","","","5.0","April 23, 2021","United States","Like an ode to the beauty of the American West, this movie captures a moment in time and yet transcends our time. Part fiction, part documentary, it took me on a familiar path and left me wondering about life then, now and more importantly my life down the road.","","Carpe Diem","3","https://www.amazon.com/gp/profile/amzn1.account.AFOAPJ7B5TRZDTWWXA7EDZR2SA7A/ref=cm_cr_arp_d_gw_btm?ie=UTF8","https://www.amazon.com/product-reviews/B095322ZW8/ref=cm_cr_arp_d_viewopt_sr?ie=UTF8&pageNumber=82&filterByStar=all_stars&sortBy=helpful&reviewerType=all_reviews","Frances McDormand","https://www.amazon.com/gp/customer-reviews/R3O48MEFU1J2KS/ref=cm_cr_arp_d_rvw_ttl?ie=UTF8&ASIN=B095322ZW8","https://www.amazon.com/-/en/Frances-McDormand/dp/B095322ZW8/ref=sr_1_4?keywords=nomadland&qid=1664326384&qu=eyJxc2MiOiIyLjQ3IiwicXNhIjoiMi43MSIsInFzcCI6IjEuMjAifQ%3D%3D&sprefix=Nomadla%2Caps%2C285&sr=8-4"
"B095322ZW8","Nomadland (4K UHD)","4.3","866","Rosie Zagarri","","Verified Purchase","","","","5.0","October 31, 2021","United States","The movie explores the lives of America's gypsies who move from place to place and job to job, partly out of financial necessity and partly from a desire to live a life on the edge. They find community in the wilderness with others who share their wanderlust, forming close bonds and experiencing joy in simple things, especially nature. The work they do is grueling, even demeaning, and exposes a segment of the American economy that seldom gets attention. The scenery--in Nevada, Nebraska, SD, and California--is starkly beautiful. Frances McDormand is, as usual, spectacular. Her performance is utterly convincing and deeply moving, without a trace o sentimentalism. A fantastic movie.","","Raw, Authentic and Poignant","","https://www.amazon.com/gp/profile/amzn1.account.AHF63EUV2PIJTVC7RPYRECBTPDHA/ref=cm_cr_arp_d_gw_btm?ie=UTF8","https://www.amazon.com/product-reviews/B095322ZW8/ref=cm_cr_arp_d_viewopt_sr?ie=UTF8&pageNumber=79&filterByStar=all_stars&sortBy=helpful&reviewerType=all_reviews","Frances McDormand","https://www.amazon.com/gp/customer-reviews/R145A0R5ZYAMWE/ref=cm_cr_arp_d_rvw_ttl?ie=UTF8&ASIN=B095322ZW8","https://www.amazon.com/-/en/Frances-McDormand/dp/B095322ZW8/ref=sr_1_4?keywords=nomadland&qid=1664326384&qu=eyJxc2MiOiIyLjQ3IiwicXNhIjoiMi43MSIsInFzcCI6IjEuMjAifQ%3D%3D&sprefix=Nomadla%2Caps%2C285&sr=8-4"
"B095322ZW8","Nomadland (4K UHD)","4.3","866","Amazon Customer","","Verified Purchase","","","","5.0","May 09, 2021","United States","Long winded but interesting","","Interesting","","https://www.amazon.com/gp/profile/amzn1.account.AHXNSCTAZTM7DNEYXAQXPCWOICAQ/ref=cm_cr_arp_d_gw_btm?ie=UTF8","https://www.amazon.com/product-reviews/B095322ZW8/ref=cm_cr_arp_d_viewopt_sr?ie=UTF8&pageNumber=46&filterByStar=all_stars&sortBy=helpful&reviewerType=all_reviews","Frances McDormand","https://www.amazon.com/gp/customer-reviews/R3KK9QG0WVT2YM/ref=cm_cr_arp_d_rvw_ttl?ie=UTF8&ASIN=B095322ZW8","https://www.amazon.com/-/en/Frances-McDormand/dp/B095322ZW8/ref=sr_1_4?keywords=nomadland&qid=1664326384&qu=eyJxc2MiOiIyLjQ3IiwicXNhIjoiMi43MSIsInFzcCI6IjEuMjAifQ%3D%3D&sprefix=Nomadla%2Caps%2C285&sr=8-4"
"B095322ZW8","Nomadland (4K UHD)","4.3","866","kfran","","Verified Purchase","","","","5.0","June 08, 2021","United States","Frances McDermont is fantastic! The movie is moving and makes you think. Excellent!","","Great Movie","","https://www.amazon.com/gp/profile/amzn1.account.AG35NNJE5GA4P6FOWVBNYVE77M4Q/ref=cm_cr_arp_d_gw_btm?ie=UTF8","https://www.amazon.com/product-reviews/B095322ZW8/ref=cm_cr_arp_d_viewopt_sr?ie=UTF8&pageNumber=38&filterByStar=all_stars&sortBy=helpful&reviewerType=all_reviews","Frances McDormand","https://www.amazon.com/gp/customer-reviews/R2G7PU00IM1BTP/ref=cm_cr_arp_d_rvw_ttl?ie=UTF8&ASIN=B095322ZW8","https://www.amazon.com/-/en/Frances-McDormand/dp/B095322ZW8/ref=sr_1_4?keywords=nomadland&qid=1664326384&qu=eyJxc2MiOiIyLjQ3IiwicXNhIjoiMi43MSIsInFzcCI6IjEuMjAifQ%3D%3D&sprefix=Nomadla%2Caps%2C285&sr=8-4"
"B095322ZW8","Nomadland (4K UHD)","4.3","866","zak j","","Verified Purchase","","","","4.0","May 21, 2021","United States","I don't think it ranks well against past Academy Award winners. Post pandemic movies aren't all that, it seems. But nonetheless, Frances McDormand is great. As per usual. Cinematography is wonderful. Very impressive considering many of the people featured are not actors. The film accomplishes the destitute our nation has sunk into at the expense of capitalist greed and corporate monopoly. I imagine only 1% of the 1% will watch. Of those people 1% will do something. 99% will order another yacht to smother any sense of shame.","","Very gritty and depressing depiction of the American Dream gone awry.","6","https://www.amazon.com/gp/profile/amzn1.account.AG7CGUFFFAT5B7X2KV3ZSCLX6LLQ/ref=cm_cr_arp_d_gw_btm?ie=UTF8","https://www.amazon.com/product-reviews/B095322ZW8/ref=cm_cr_arp_d_viewopt_sr?ie=UTF8&pageNumber=6&filterByStar=all_stars&sortBy=helpful&reviewerType=all_reviews","Frances McDormand","https://www.amazon.com/gp/customer-reviews/RDTL0V76X9DMY/ref=cm_cr_arp_d_rvw_ttl?ie=UTF8&ASIN=B095322ZW8","https://www.amazon.com/-/en/Frances-McDormand/dp/B095322ZW8/ref=sr_1_4?keywords=nomadland&qid=1664326384&qu=eyJxc2MiOiIyLjQ3IiwicXNhIjoiMi43MSIsInFzcCI6IjEuMjAifQ%3D%3D&sprefix=Nomadla%2Caps%2C285&sr=8-4"
"B095322ZW8","Nomadland (4K UHD)","4.3","866","Gatlin","","Verified Purchase","","","","4.0","July 18, 2021","United States","Interesting documentary but I am sure some would rather take a pass. Just beware. Gave it 4 stars.","","Interesting documentary.","","https://www.amazon.com/gp/profile/amzn1.account.AEU5U4VWKT5QLLDZEJXCLIID6ZSA/ref=cm_cr_arp_d_gw_btm?ie=UTF8","https://www.amazon.com/product-reviews/B095322ZW8/ref=cm_cr_arp_d_viewopt_sr?ie=UTF8&pageNumber=11&filterByStar=all_stars&sortBy=helpful&reviewerType=all_reviews","Frances McDormand","https://www.amazon.com/gp/customer-reviews/RCXXHWCV32W38/ref=cm_cr_arp_d_rvw_ttl?ie=UTF8&ASIN=B095322ZW8","https://www.amazon.com/-/en/Frances-McDormand/dp/B095322ZW8/ref=sr_1_4?keywords=nomadland&qid=1664326384&qu=eyJxc2MiOiIyLjQ3IiwicXNhIjoiMi43MSIsInFzcCI6IjEuMjAifQ%3D%3D&sprefix=Nomadla%2Caps%2C285&sr=8-4"
"B095322ZW8","Nomadland (4K UHD)","4.3","866","O.C. Hardesty","","Verified Purchase","","","","4.0","July 20, 2021","United States 🇺🇸","Interesting story about middle America that I never gave much thought to. Frances McDormand gives a terrific performance as she always does. But is it Oscar-Worthy as a movie? I think not.","","Interesting and Entertaining","","https://www.amazon.com/gp/profile/amzn1.account.AHA7SCSRYAZHTUGRWUTJMTPTI7KA/ref=cm_cr_arp_d_gw_btm?ie=UTF8","https://www.amazon.com/product-reviews/B095322ZW8/ref=cm_cr_arp_d_viewopt_sr?ie=UTF8&pageNumber=9&filterByStar=all_stars&sortBy=helpful&reviewerType=all_reviews","Frances McDormand","https://www.amazon.com/gp/customer-reviews/R24MCEIV6NBOGP/ref=cm_cr_arp_d_rvw_ttl?ie=UTF8&ASIN=B095322ZW8","https://www.amazon.com/-/en/Frances-McDormand/dp/B095322ZW8/ref=sr_1_4?keywords=nomadland&qid=1664326384&qu=eyJxc2MiOiIyLjQ3IiwicXNhIjoiMi43MSIsInFzcCI6IjEuMjAifQ%3D%3D&sprefix=Nomadla%2Caps%2C285&sr=8-4"
"B095322ZW8","Nomadland (4K UHD)","4.3","866","Jurel zeffrilli","","Verified Purchase","","","","5.0","May 24, 2021","United States","Good blend of professional acting with the real nomads . GREAT cinematography! Well edited.","","A review of a different lifestyle","1","https://www.amazon.com/gp/profile/amzn1.account.AGYNLNLP727ZZMAURTQY7JVUITJQ/ref=cm_cr_arp_d_gw_btm?ie=UTF8","https://www.amazon.com/product-reviews/B095322ZW8/ref=cm_cr_arp_d_viewopt_sr?ie=UTF8&pageNumber=40&filterByStar=all_stars&sortBy=helpful&reviewerType=all_reviews","Frances McDormand","https://www.amazon.com/gp/customer-reviews/RRW86UA7C1TTN/ref=cm_cr_arp_d_rvw_ttl?ie=UTF8&ASIN=B095322ZW8","https://www.amazon.com/-/en/Frances-McDormand/dp/B095322ZW8/ref=sr_1_4?keywords=nomadland&qid=1664326384&qu=eyJxc2MiOiIyLjQ3IiwicXNhIjoiMi43MSIsInFzcCI6IjEuMjAifQ%3D%3D&sprefix=Nomadla%2Caps%2C285&sr=8-4"
"B095322ZW8","Nomadland (4K UHD)","4.3","866","sokha peou","","Verified Purchase","","","","5.0","April 16, 2021","United States","Good movie","","Movie","","https://www.amazon.com/gp/profile/amzn1.account.AEYVCHPNAENYOX7WSN5JUPUSZXZA/ref=cm_cr_arp_d_gw_btm?ie=UTF8","https://www.amazon.com/product-reviews/B095322ZW8/ref=cm_cr_arp_d_viewopt_sr?ie=UTF8&pageNumber=49&filterByStar=all_stars&sortBy=helpful&reviewerType=all_reviews","Frances McDormand","https://www.amazon.com/gp/customer-reviews/R2F1ERFZUN7NA3/ref=cm_cr_arp_d_rvw_ttl?ie=UTF8&ASIN=B095322ZW8","https://www.amazon.com/-/en/Frances-McDormand/dp/B095322ZW8/ref=sr_1_4?keywords=nomadland&qid=1664326384&qu=eyJxc2MiOiIyLjQ3IiwicXNhIjoiMi43MSIsInFzcCI6IjEuMjAifQ%3D%3D&sprefix=Nomadla%2Caps%2C285&sr=8-4"
"B095322ZW8","Nomadland (4K UHD)","4.3","866","Kimberly M. Williams","","Verified Purchase","","","","1.0","May 09, 2021","United States","This was very hard to watch because the soundtrack was not lined up with the video. The character would speak and several seconds would pass before I could hear the voice. I was very disappointed because I was looking forward to watching this. I tried to stop and restart the video and it did not solve the problem. :-(","","Soundtrack was not in synch with video","","https://www.amazon.com/gp/profile/amzn1.account.AFK4KKJEH2D3YHEAIHTL5Q3TM2VA/ref=cm_cr_arp_d_gw_btm?ie=UTF8","https://www.amazon.com/product-reviews/B095322ZW8/ref=cm_cr_arp_d_viewopt_sr?ie=UTF8&pageNumber=54&filterByStar=all_stars&sortBy=helpful&reviewerType=all_reviews","Frances McDormand","https://www.amazon.com/gp/customer-reviews/RL1KJCX6TKZP6/ref=cm_cr_arp_d_rvw_ttl?ie=UTF8&ASIN=B095322ZW8","https://www.amazon.com/-/en/Frances-McDormand/dp/B095322ZW8/ref=sr_1_4?keywords=nomadland&qid=1664326384&qu=eyJxc2MiOiIyLjQ3IiwicXNhIjoiMi43MSIsInFzcCI6IjEuMjAifQ%3D%3D&sprefix=Nomadla%2Caps%2C285&sr=8-4"
"B095322ZW8","Nomadland (4K UHD)","4.3","866","Gonzojuice","","Verified Purchase","","","","5.0","June 06, 2021","United States","A must see!","","Frances!","","https://www.amazon.com/gp/profile/amzn1.account.AE73XRVPWRVTERI2O6F4B7LLUTBQ/ref=cm_cr_arp_d_gw_btm?ie=UTF8","https://www.amazon.com/product-reviews/B095322ZW8/ref=cm_cr_arp_d_viewopt_sr?ie=UTF8&pageNumber=49&filterByStar=all_stars&sortBy=helpful&reviewerType=all_reviews","Frances McDormand","https://www.amazon.com/gp/customer-reviews/R344JP5SWJ03Y6/ref=cm_cr_arp_d_rvw_ttl?ie=UTF8&ASIN=B095322ZW8","https://www.amazon.com/-/en/Frances-McDormand/dp/B095322ZW8/ref=sr_1_4?keywords=nomadland&qid=1664326384&qu=eyJxc2MiOiIyLjQ3IiwicXNhIjoiMi43MSIsInFzcCI6IjEuMjAifQ%3D%3D&sprefix=Nomadla%2Caps%2C285&sr=8-4"
"B095322ZW8","Nomadland (4K UHD)","4.3","866","Amazon Customer","","Verified Purchase","","","","5.0","November 22, 2021","United States 🇺🇸","This was an extraordinary movie. It messages were respectfully given without violence. The non-actor cast was dedicated and honest in its roles.","","Frances Mcdormand","","https://www.amazon.com/gp/profile/amzn1.account.AH4GACJL5L5BEWBD3B3EY5SEU3EQ/ref=cm_cr_arp_d_gw_btm?ie=UTF8","https://www.amazon.com/product-reviews/B095322ZW8/ref=cm_cr_arp_d_viewopt_sr?ie=UTF8&pageNumber=17&filterByStar=all_stars&sortBy=helpful&reviewerType=all_reviews","Frances McDormand","https://www.amazon.com/gp/customer-reviews/R3DCVG18PFHG4J/ref=cm_cr_arp_d_rvw_ttl?ie=UTF8&ASIN=B095322ZW8","https://www.amazon.com/-/en/Frances-McDormand/dp/B095322ZW8/ref=sr_1_4?keywords=nomadland&qid=1664326384&qu=eyJxc2MiOiIyLjQ3IiwicXNhIjoiMi43MSIsInFzcCI6IjEuMjAifQ%3D%3D&sprefix=Nomadla%2Caps%2C285&sr=8-4"
"B095322ZW8","Nomadland (4K UHD)","4.3","866","BeautifulLife","","Verified Purchase","","","","1.0","May 01, 2021","United States 🇺🇸","I can appreciate what the film tried to accomplish, but Frances McDormand did not convince me in her performance, I felt she played herself. I just couldn't connect with her character and was relieved when the movie was finally over. The cinematography was beautiful, but probably because the landscape is naturally breathtaking. So disappointed that the Academy Awards favored this movie so much when there where such other great movies and performances to chose from. 5","","Did not like it!","5","https://www.amazon.com/gp/profile/amzn1.account.AF66JOP6Q2BKSKHUHOQGO6EVWIQA/ref=cm_cr_arp_d_gw_btm?ie=UTF8","https://www.amazon.com/product-reviews/B095322ZW8/ref=cm_cr_arp_d_viewopt_sr?ie=UTF8&pageNumber=53&filterByStar=all_stars&sortBy=helpful&reviewerType=all_reviews","Frances McDormand","https://www.amazon.com/gp/customer-reviews/RQ176PXT6OY1B/ref=cm_cr_arp_d_rvw_ttl?ie=UTF8&ASIN=B095322ZW8","https://www.amazon.com/-/en/Frances-McDormand/dp/B095322ZW8/ref=sr_1_4?keywords=nomadland&qid=1664326384&qu=eyJxc2MiOiIyLjQ3IiwicXNhIjoiMi43MSIsInFzcCI6IjEuMjAifQ%3D%3D&sprefix=Nomadla%2Caps%2C285&sr=8-4"
"B095322ZW8","Nomadland (4K UHD)","4.3","866","Robee","","Verified Purchase","","","","5.0","August 15, 2021","United States","I really adore this actress in everything she does! She’s so talented!","","Enjoyed!","","https://www.amazon.com/gp/profile/amzn1.account.AGLHMTXR5324ISVCNCFTFQL2TZPQ/ref=cm_cr_arp_d_gw_btm?ie=UTF8","https://www.amazon.com/product-reviews/B095322ZW8/ref=cm_cr_arp_d_viewopt_sr?ie=UTF8&pageNumber=33&filterByStar=all_stars&sortBy=helpful&reviewerType=all_reviews","Frances McDormand","https://www.amazon.com/gp/customer-reviews/R105M3D41VPDJG/ref=cm_cr_arp_d_rvw_ttl?ie=UTF8&ASIN=B095322ZW8","https://www.amazon.com/-/en/Frances-McDormand/dp/B095322ZW8/ref=sr_1_4?keywords=nomadland&qid=1664326384&qu=eyJxc2MiOiIyLjQ3IiwicXNhIjoiMi43MSIsInFzcCI6IjEuMjAifQ%3D%3D&sprefix=Nomadla%2Caps%2C285&sr=8-4"
"B095322ZW8","Nomadland (4K UHD)","4.3","866","Gunshot","","Verified Purchase","","","","3.0","October 05, 2021","Germany","Für Mcdormand Fans ist dieser Film sicher ein Muss... für ein Publikum das eine spannende Story erwartet sicher nicht. Der Film plätschert vor sich hin wie ein ruhiger Arthouse Film und begleitet die Mcdormand auf ihrem Weg ins Ungewisse. All das ist zwar recht atmosphärisch aber nicht vergleichbar mit ihren vorherigen inhaltlich bewegenden Filmen wie z.B. Promised Land, Olive Kitteridge oder 3 Billboards. Wer hier sowas erwartet... wird zwangsläufig enttäuscht werden. Wem hingegen ein Film mit Porträt-Charakter genügt kann bedenkenlos zugreifen.","","Leider nur ein halbdokumentarisches Roadmovie-Porträt...","2","","https://www.amazon.com/product-reviews/B095322ZW8/ref=cm_cr_arp_d_viewopt_sr?ie=UTF8&pageNumber=85&filterByStar=all_stars&sortBy=helpful&reviewerType=all_reviews","Frances McDormand","","https://www.amazon.com/-/en/Frances-McDormand/dp/B095322ZW8/ref=sr_1_4?keywords=nomadland&qid=1664326384&qu=eyJxc2MiOiIyLjQ3IiwicXNhIjoiMi43MSIsInFzcCI6IjEuMjAifQ%3D%3D&sprefix=Nomadla%2Caps%2C285&sr=8-4"
"B095322ZW8","Nomadland (4K UHD)","4.3","866","karen ryan danielian","","Verified Purchase","","","","2.0","June 28, 2021","United States 🇺🇸","This movie was just depressing....","","Sooo slow!","","https://www.amazon.com/gp/profile/amzn1.account.AHYUSZJCDOTD7ISPFJQKAI6ZSTSA/ref=cm_cr_arp_d_gw_btm?ie=UTF8","https://www.amazon.com/product-reviews/B095322ZW8/ref=cm_cr_arp_d_viewopt_sr?ie=UTF8&pageNumber=57&filterByStar=all_stars&sortBy=helpful&reviewerType=all_reviews","Frances McDormand","https://www.amazon.com/gp/customer-reviews/RDGDPQMVJ5W7J/ref=cm_cr_arp_d_rvw_ttl?ie=UTF8&ASIN=B095322ZW8","https://www.amazon.com/-/en/Frances-McDormand/dp/B095322ZW8/ref=sr_1_4?keywords=nomadland&qid=1664326384&qu=eyJxc2MiOiIyLjQ3IiwicXNhIjoiMi43MSIsInFzcCI6IjEuMjAifQ%3D%3D&sprefix=Nomadla%2Caps%2C285&sr=8-4"
"B095322ZW8","Nomadland (4K UHD)","4.3","866","Kindle Customer","","Verified Purchase","","","","1.0","May 17, 2021","United States","I found the movie to be a waste of my time. I've followed Bob Wells, the nomad teacher, in the movie for about 3 years. The movie didn't even represent him or his annual meetup very well. I suggest watching Bob Well's on YouTube before you decide how you feel about the nomad lifestyle. Bob's interviews tend to be very uplifting and their vans, cars or rv homes and much nicer looking inside than what the movie presents. The movie seemed to just have an agenda of trying to win awards.","","Depressing and Misleading","4","https://www.amazon.com/gp/profile/amzn1.account.AFWTBMZGLDUSG7S3OVSIT5FCZMBA/ref=cm_cr_arp_d_gw_btm?ie=UTF8","https://www.amazon.com/product-reviews/B095322ZW8/ref=cm_cr_arp_d_viewopt_sr?ie=UTF8&pageNumber=51&filterByStar=all_stars&sortBy=helpful&reviewerType=all_reviews","Frances McDormand","https://www.amazon.com/gp/customer-reviews/R1PAH9L3RN13NT/ref=cm_cr_arp_d_rvw_ttl?ie=UTF8&ASIN=B095322ZW8","https://www.amazon.com/-/en/Frances-McDormand/dp/B095322ZW8/ref=sr_1_4?keywords=nomadland&qid=1664326384&qu=eyJxc2MiOiIyLjQ3IiwicXNhIjoiMi43MSIsInFzcCI6IjEuMjAifQ%3D%3D&sprefix=Nomadla%2Caps%2C285&sr=8-4"
