"asin","product_title","average_rating","total_reviews","review_author","author_badge","badge","reviewed_product_attribute","reviewed_variant_asin","variant_review_url","review_rating","review_date","reviewed_country","review_text","review_comment_count","review_header","no_of_people_reacted_helpful","author_profile_url","url","brand","review_url","input"
"B095322ZW8","Nomadland (4K UHD)","4.3","866","Denville","","Verified Purchase","","","","4.0","July 09, 2021","United States","Enjoyed watching the movie. Didn't realize people lived like this and are happy? Every young adult needs to view this story and then decide.","","A Learning Experience & Humbling Story","","https://www.amazon.com/gp/profile/amzn1.account.AEQNCRQCKBBPPK5HVLV46QWLF6UA/ref=cm_cr_arp_d_gw_btm?ie=UTF8","https://www.amazon.com/product-reviews/B095322ZW8/ref=cm_cr_arp_d_viewopt_sr?ie=UTF8&pageNumber=11&filterByStar=all_stars&sortBy=helpful&reviewerType=all_reviews","Frances McDormand","https://www.amazon.com/gp/customer-reviews/R1E190O0UXT907/ref=cm_cr_arp_d_rvw_ttl?ie=UTF8&ASIN=B095322ZW8","https://www.amazon.com/-/en/Frances-McDormand/dp/B095322ZW8/ref=sr_1_4?keywords=nomadland&qid=1664326384&qu=eyJxc2MiOiIyLjQ3IiwicXNhIjoiMi43MSIsInFzcCI6IjEuMjAifQ%3D%3D&sprefix=Nomadla%2Caps%2C285&sr=8-4"
"B095322ZW8","Nomadland (4K UHD)","4.3","866","Nouno","","Verified Purchase","","","","3.0","June 21, 2021","United States 🇺🇸","A great performance by Frances McDormand but, for me, the plot just plodded along, with interesting vignettes here and there but pacing that just didn't do it for me. I can see why the film won the Academy Award but it's not going to be everyone's cup of tea - just like all movies, some you like, some less so.","","A bit of a slog","","https://www.amazon.com/gp/profile/amzn1.account.AF4WAHJ2GKK35SXOVYL7DZUA7PKQ/ref=cm_cr_arp_d_gw_btm?ie=UTF8","https://www.amazon.com/product-reviews/B095322ZW8/ref=cm_cr_arp_d_viewopt_sr?ie=UTF8&pageNumber=17&filterByStar=all_stars&sortBy=helpful&reviewerType=all_reviews","Frances McDormand","https://www.amazon.com/gp/customer-reviews/RDVRLQL2AR0IJ/ref=cm_cr_arp_d_rvw_ttl?ie=UTF8&ASIN=B095322ZW8","https://www.amazon.com/-/en/Frances-McDormand/dp/B095322ZW8/ref=sr_1_4?keywords=nomadland&qid=1664326384&qu=eyJxc2MiOiIyLjQ3IiwicXNhIjoiMi43MSIsInFzcCI6IjEuMjAifQ%3D%3D&sprefix=Nomadla%2Caps%2C285&sr=8-4"
"B095322ZW8","Nomadland (4K UHD)","4.3","866","jean peters","","Verified Purchase","","","","4.0","July 17, 2021","United States 🇺🇸","My husband and I are familiar with this life style, except I wasn't aware of the depression and sorrow for lots of these folks.","","Traveling Nomads","","https://www.amazon.com/gp/profile/amzn1.account.AGOE5DY72OI5HZEFKVSKU6EFQP2Q/ref=cm_cr_arp_d_gw_btm?ie=UTF8","https://www.amazon.com/product-reviews/B095322ZW8/ref=cm_cr_arp_d_viewopt_sr?ie=UTF8&pageNumber=10&filterByStar=all_stars&sortBy=helpful&reviewerType=all_reviews","Frances McDormand","https://www.amazon.com/gp/customer-reviews/RDVL828SR2DAC/ref=cm_cr_arp_d_rvw_ttl?ie=UTF8&ASIN=B095322ZW8","https://www.amazon.com/-/en/Frances-McDormand/dp/B095322ZW8/ref=sr_1_4?keywords=nomadland&qid=1664326384&qu=eyJxc2MiOiIyLjQ3IiwicXNhIjoiMi43MSIsInFzcCI6IjEuMjAifQ%3D%3D&sprefix=Nomadla%2Caps%2C285&sr=8-4"
"B095322ZW8","Nomadland (4K UHD)","4.3","866","G E B","","","","","","1.0","May 27, 2021","United States 🇺🇸","Nuff said. I used to respect and even enjoy what McDormand did as an artist. But this is not the woman I admire even in retrospect. Go see Fargo and then try to stomach your way through this boring screenplay. It❜s not all her fault, but she should have known better. To have gibven her an award for this‽ Fuggedaboudit.","","Boring & depressing, one-note. She phones in another role","","https://www.amazon.com/gp/profile/amzn1.account.AGQDO5ZIBUP6EKH73Y57ZWUT2HCQ/ref=cm_cr_arp_d_gw_btm?ie=UTF8","https://www.amazon.com/product-reviews/B095322ZW8/ref=cm_cr_arp_d_viewopt_sr?ie=UTF8&pageNumber=76&filterByStar=all_stars&sortBy=helpful&reviewerType=all_reviews","Frances McDormand","https://www.amazon.com/gp/customer-reviews/R2I823T3K4GT11/ref=cm_cr_arp_d_rvw_ttl?ie=UTF8&ASIN=B095322ZW8","https://www.amazon.com/-/en/Frances-McDormand/dp/B095322ZW8/ref=sr_1_4?keywords=nomadland&qid=1664326384&qu=eyJxc2MiOiIyLjQ3IiwicXNhIjoiMi43MSIsInFzcCI6IjEuMjAifQ%3D%3D&sprefix=Nomadla%2Caps%2C285&sr=8-4"
"B095322ZW8","Nomadland (4K UHD)","4.3","866","Amazon Customer","","Verified Purchase","","","","1.0","May 19, 2021","United States","Dull dull and yes dull","","Dull with no end","","https://www.amazon.com/gp/profile/amzn1.account.AFDBOQMNXTJU5OG2JLPW3QIF2WMA/ref=cm_cr_arp_d_gw_btm?ie=UTF8","https://www.amazon.com/product-reviews/B095322ZW8/ref=cm_cr_arp_d_viewopt_sr?ie=UTF8&pageNumber=67&filterByStar=all_stars&sortBy=helpful&reviewerType=all_reviews","Frances McDormand","https://www.amazon.com/gp/customer-reviews/R27KL16G9AU9DF/ref=cm_cr_arp_d_rvw_ttl?ie=UTF8&ASIN=B095322ZW8","https://www.amazon.com/-/en/Frances-McDormand/dp/B095322ZW8/ref=sr_1_4?keywords=nomadland&qid=1664326384&qu=eyJxc2MiOiIyLjQ3IiwicXNhIjoiMi43MSIsInFzcCI6IjEuMjAifQ%3D%3D&sprefix=Nomadla%2Caps%2C285&sr=8-4"
"B095322ZW8","Nomadland (4K UHD)","4.3","866","DGITT","","Verified Purchase","","","","5.0","April 18, 2021","United States 🇺🇸","I don’t often write reviews but this film touched me on such a deep level I was moved to write. It’s more a character study than plot, and mixes quiet stories both of real people and and the composite main character who seamlessly fits in with the others. As someone now around the age of Fern in this film, who during the past COVID year has realized both the incredible lack of safety nets available in this country during times of recession or serious illness (and being in the first generation facing elder years without pensions or adequate healthcare), at a time of life where personal losses and job discrimination steadily increase across socioeconomic classes, I was moved to see so much resilience and beauty in the very difficult lifestyle choices they made. The real stories added a lot. I have a friend who did live this van life for a decade before serious health issues set in and I know both how hard the life is and yet how connected they felt both to the land and fellow travelers. The travelers are mostly apolitical which I also really appreciated. No soapbox - just quietly understated journey. In the midst of personal loss this film filled me with hope and appreciation of the resilience and creativity we have to still make choices, and the ways even seemingly disconnected people still find connection and beauty in life.","","Beautiful film of resilience in the face of loss","162","https://www.amazon.com/gp/profile/amzn1.account.AFNQ3YZ7DNHGJPQEOA4FPLLFJMYA/ref=cm_cr_arp_d_gw_btm?ie=UTF8","https://www.amazon.com/product-reviews/B095322ZW8/ref=cm_cr_arp_d_viewopt_sr?ie=UTF8&pageNumber=3&filterByStar=all_stars&sortBy=helpful&reviewerType=all_reviews","Frances McDormand","https://www.amazon.com/gp/customer-reviews/RD860WQU16DOD/ref=cm_cr_arp_d_rvw_ttl?ie=UTF8&ASIN=B095322ZW8","https://www.amazon.com/-/en/Frances-McDormand/dp/B095322ZW8/ref=sr_1_4?keywords=nomadland&qid=1664326384&qu=eyJxc2MiOiIyLjQ3IiwicXNhIjoiMi43MSIsInFzcCI6IjEuMjAifQ%3D%3D&sprefix=Nomadla%2Caps%2C285&sr=8-4"
"B095322ZW8","Nomadland (4K UHD)","4.3","866","Bruce F. Wilken","","Verified Purchase","","","","2.0","June 25, 2021","United States 🇺🇸","I think this won an Oscar, if I'm not mistaken? Probably pretty realistic in this day and age, but a slow movie. I guess you'd call it a 'character study', but we weren't impressed. I probably wouldn't pay to buy or rent it and just wait for it to stream for free.","","Overrated","","https://www.amazon.com/gp/profile/amzn1.account.AEPQDW6QPMBFGJVYNZ4MTWPX2KHQ/ref=cm_cr_arp_d_gw_btm?ie=UTF8","https://www.amazon.com/product-reviews/B095322ZW8/ref=cm_cr_arp_d_viewopt_sr?ie=UTF8&pageNumber=44&filterByStar=all_stars&sortBy=helpful&reviewerType=all_reviews","Frances McDormand","https://www.amazon.com/gp/customer-reviews/RTLTTWHEW40UZ/ref=cm_cr_arp_d_rvw_ttl?ie=UTF8&ASIN=B095322ZW8","https://www.amazon.com/-/en/Frances-McDormand/dp/B095322ZW8/ref=sr_1_4?keywords=nomadland&qid=1664326384&qu=eyJxc2MiOiIyLjQ3IiwicXNhIjoiMi43MSIsInFzcCI6IjEuMjAifQ%3D%3D&sprefix=Nomadla%2Caps%2C285&sr=8-4"
"B095322ZW8","Nomadland (4K UHD)","4.3","866","Pavel VK","","Verified Purchase","","","","5.0","September 10, 2021","United States","I think this move requires a certain level of knowledge and a sense of culture in its diversity. It also requires a certain condition of the ""heart"" of a person who watches it to get it. It is educational material for every level of the earth life hood in its essence. I got at least 20 life/economy/relationship/family/retirement etc. pointers while watching this. Amazing movie! Loved it!","","Goodness in its essence.","","https://www.amazon.com/gp/profile/amzn1.account.AFTUIXYKHLGGWXPCSB7V2QYD6P6A/ref=cm_cr_arp_d_gw_btm?ie=UTF8","https://www.amazon.com/product-reviews/B095322ZW8/ref=cm_cr_arp_d_viewopt_sr?ie=UTF8&pageNumber=80&filterByStar=all_stars&sortBy=helpful&reviewerType=all_reviews","Frances McDormand","https://www.amazon.com/gp/customer-reviews/R1NFOOIQ4BQP9Q/ref=cm_cr_arp_d_rvw_ttl?ie=UTF8&ASIN=B095322ZW8","https://www.amazon.com/-/en/Frances-McDormand/dp/B095322ZW8/ref=sr_1_4?keywords=nomadland&qid=1664326384&qu=eyJxc2MiOiIyLjQ3IiwicXNhIjoiMi43MSIsInFzcCI6IjEuMjAifQ%3D%3D&sprefix=Nomadla%2Caps%2C285&sr=8-4"
"B095322ZW8","Nomadland (4K UHD)","4.3","866","mhbrooks","","Verified Purchase","","","","5.0","May 20, 2021","United States","I was lost in thought for twenty minutes after the movie ended. It is a very moving and well-done work.","","It Makes You Think About Life and Its Meaning","1","https://www.amazon.com/gp/profile/amzn1.account.AETF7BSLGR3LMHPYZOIYCNUKV2HQ/ref=cm_cr_arp_d_gw_btm?ie=UTF8","https://www.amazon.com/product-reviews/B095322ZW8/ref=cm_cr_arp_d_viewopt_sr?ie=UTF8&pageNumber=36&filterByStar=all_stars&sortBy=helpful&reviewerType=all_reviews","Frances McDormand","https://www.amazon.com/gp/customer-reviews/R1NBKCXH3U6T2Q/ref=cm_cr_arp_d_rvw_ttl?ie=UTF8&ASIN=B095322ZW8","https://www.amazon.com/-/en/Frances-McDormand/dp/B095322ZW8/ref=sr_1_4?keywords=nomadland&qid=1664326384&qu=eyJxc2MiOiIyLjQ3IiwicXNhIjoiMi43MSIsInFzcCI6IjEuMjAifQ%3D%3D&sprefix=Nomadla%2Caps%2C285&sr=8-4"
"B095322ZW8","Nomadland (4K UHD)","4.3","866","Ginny","","Verified Purchase","","","","2.0","May 02, 2021","United States","The trailer is the film. I have the strong impression that this could have been a much better film with better acting, better script, better story, better filming, better direction. I was left with the impression of a kind of artificial version of the modern American nomad and the environment in which they, and we, live. I don't know who I would recommend this movie to. Most people are much more interesting than this.","","Unreal Real Reel","2","https://www.amazon.com/gp/profile/amzn1.account.AHGEBNCOSQS44AJSNLQ5HOOPMTEA/ref=cm_cr_arp_d_gw_btm?ie=UTF8","https://www.amazon.com/product-reviews/B095322ZW8/ref=cm_cr_arp_d_viewopt_sr?ie=UTF8&pageNumber=36&filterByStar=all_stars&sortBy=helpful&reviewerType=all_reviews","Frances McDormand","https://www.amazon.com/gp/customer-reviews/R1042URW6RKI5O/ref=cm_cr_arp_d_rvw_ttl?ie=UTF8&ASIN=B095322ZW8","https://www.amazon.com/-/en/Frances-McDormand/dp/B095322ZW8/ref=sr_1_4?keywords=nomadland&qid=1664326384&qu=eyJxc2MiOiIyLjQ3IiwicXNhIjoiMi43MSIsInFzcCI6IjEuMjAifQ%3D%3D&sprefix=Nomadla%2Caps%2C285&sr=8-4"
"B095322ZW8","Nomadland (4K UHD)","4.3","866","ZL","","Verified Purchase","","","","2.0","July 15, 2021","United States 🇺🇸","Pretty bland. Weird mix of documentary and slow drama. Probably wouldn't recommend unless you're desperate to see McDormand","","More of a Documentary than They Let On","","https://www.amazon.com/gp/profile/amzn1.account.AFQHMACMVXNSYDJ6BHQDNY4KILYQ/ref=cm_cr_arp_d_gw_btm?ie=UTF8","https://www.amazon.com/product-reviews/B095322ZW8/ref=cm_cr_arp_d_viewopt_sr?ie=UTF8&pageNumber=53&filterByStar=all_stars&sortBy=helpful&reviewerType=all_reviews","Frances McDormand","https://www.amazon.com/gp/customer-reviews/RIER91CB0AOB7/ref=cm_cr_arp_d_rvw_ttl?ie=UTF8&ASIN=B095322ZW8","https://www.amazon.com/-/en/Frances-McDormand/dp/B095322ZW8/ref=sr_1_4?keywords=nomadland&qid=1664326384&qu=eyJxc2MiOiIyLjQ3IiwicXNhIjoiMi43MSIsInFzcCI6IjEuMjAifQ%3D%3D&sprefix=Nomadla%2Caps%2C285&sr=8-4"
"B095322ZW8","Nomadland (4K UHD)","4.3","866","Didijo","","Verified Purchase","","","","5.0","November 10, 2021","United States 🇺🇸","Good show, a bit sad, but very interesting.","","Enjoyed this movie.","","https://www.amazon.com/gp/profile/amzn1.account.AGHZCVPFQ24NN5MOKCNOMIPFWLGA/ref=cm_cr_arp_d_gw_btm?ie=UTF8","https://www.amazon.com/product-reviews/B095322ZW8/ref=cm_cr_arp_d_viewopt_sr?ie=UTF8&pageNumber=25&filterByStar=all_stars&sortBy=helpful&reviewerType=all_reviews","Frances McDormand","https://www.amazon.com/gp/customer-reviews/RCB4C8SHRW2LD/ref=cm_cr_arp_d_rvw_ttl?ie=UTF8&ASIN=B095322ZW8","https://www.amazon.com/-/en/Frances-McDormand/dp/B095322ZW8/ref=sr_1_4?keywords=nomadland&qid=1664326384&qu=eyJxc2MiOiIyLjQ3IiwicXNhIjoiMi43MSIsInFzcCI6IjEuMjAifQ%3D%3D&sprefix=Nomadla%2Caps%2C285&sr=8-4"
"B095322ZW8","Nomadland (4K UHD)","4.3","866","Suzy Q","","Verified Purchase","","","","1.0","November 26, 2021","United States 🇺🇸","Sad. The movie is depressing. Probably true but sad.","","Depressing movie","1","https://www.amazon.com/gp/profile/amzn1.account.AHKJR3SBUETLZ7YOCDBN3HOJGZGA/ref=cm_cr_arp_d_gw_btm?ie=UTF8","https://www.amazon.com/product-reviews/B095322ZW8/ref=cm_cr_arp_d_viewopt_sr?ie=UTF8&pageNumber=61&filterByStar=all_stars&sortBy=helpful&reviewerType=all_reviews","Frances McDormand","https://www.amazon.com/gp/customer-reviews/R5ZFO6XYFKYZ1/ref=cm_cr_arp_d_rvw_ttl?ie=UTF8&ASIN=B095322ZW8","https://www.amazon.com/-/en/Frances-McDormand/dp/B095322ZW8/ref=sr_1_4?keywords=nomadland&qid=1664326384&qu=eyJxc2MiOiIyLjQ3IiwicXNhIjoiMi43MSIsInFzcCI6IjEuMjAifQ%3D%3D&sprefix=Nomadla%2Caps%2C285&sr=8-4"
"B095322ZW8","Nomadland (4K UHD)","4.3","866","ldemar","","Verified Purchase","","","","5.0","April 27, 2021","United States 🇺🇸","i can't say anything that will do this slice of life justice so i'll just put a quote from the movie below that made me get up and hug the computer, because i couldn't hug the man min 1hr 36min i rarely ever talk about my son today would be his 33rd birthday and 5 years ago he took his life and i can still barely say that in a sentence and for a long time every day was a... the questions was how can i be alive on this earth when he is not? and i didn't have a answer and those were some hard hard days but i realize that i could honor him by helping people and serving people and it gives me a reason to go through the day and some days that's all i've got and now, here, there is a lot of people our age and there is a lot of grief and loss and a lot of them don't get over it and that's ok, that's okay one of the things i love most about this life is that there is no final goodbye i've met hundreds of people out here and dont ever say a final goodbye i just say i'll see you down the road and i do i see them again i can be certain in my heart that i will see my son again","","Ooooh...such beautiful people","31","https://www.amazon.com/gp/profile/amzn1.account.AH7TB754Q76SZ57ZWWFVX2BD7A2A/ref=cm_cr_arp_d_gw_btm?ie=UTF8","https://www.amazon.com/product-reviews/B095322ZW8/ref=cm_cr_arp_d_viewopt_sr?ie=UTF8&pageNumber=3&filterByStar=all_stars&sortBy=helpful&reviewerType=all_reviews","Frances McDormand","https://www.amazon.com/gp/customer-reviews/R26FNY588WOIM7/ref=cm_cr_arp_d_rvw_ttl?ie=UTF8&ASIN=B095322ZW8","https://www.amazon.com/-/en/Frances-McDormand/dp/B095322ZW8/ref=sr_1_4?keywords=nomadland&qid=1664326384&qu=eyJxc2MiOiIyLjQ3IiwicXNhIjoiMi43MSIsInFzcCI6IjEuMjAifQ%3D%3D&sprefix=Nomadla%2Caps%2C285&sr=8-4"
"B095322ZW8","Nomadland (4K UHD)","4.3","866","H. E. Payton","","Verified Purchase","","","","5.0","May 25, 2021","United States 🇺🇸","Awesome movie, fantastic acting, highly recommend.","","Don't miss this one!","1","https://www.amazon.com/gp/profile/amzn1.account.AGVAG4WTKL25ZHD7UBFVAP24ORDQ/ref=cm_cr_arp_d_gw_btm?ie=UTF8","https://www.amazon.com/product-reviews/B095322ZW8/ref=cm_cr_arp_d_viewopt_sr?ie=UTF8&pageNumber=47&filterByStar=all_stars&sortBy=helpful&reviewerType=all_reviews","Frances McDormand","https://www.amazon.com/gp/customer-reviews/R3FB366L9LWAZL/ref=cm_cr_arp_d_rvw_ttl?ie=UTF8&ASIN=B095322ZW8","https://www.amazon.com/-/en/Frances-McDormand/dp/B095322ZW8/ref=sr_1_4?keywords=nomadland&qid=1664326384&qu=eyJxc2MiOiIyLjQ3IiwicXNhIjoiMi43MSIsInFzcCI6IjEuMjAifQ%3D%3D&sprefix=Nomadla%2Caps%2C285&sr=8-4"
"B095322ZW8","Nomadland (4K UHD)","4.3","866","TK","","Verified Purchase","","","","1.0","June 01, 2021","United States 🇺🇸","Lots of different messages that don’t connect, very superficial, no character development or progression throughout the movie. Despite trying, I felt no emotional connection to Fran. Forced, simple dialogue that doesn’t seem to care for risky, deep takes on expressing reality. It tries to be moving, but fails.","","Vapid messaging","","https://www.amazon.com/gp/profile/amzn1.account.AGPCJ4PRFVDYBBCYCGEKYF5RCTKA/ref=cm_cr_arp_d_gw_btm?ie=UTF8","https://www.amazon.com/product-reviews/B095322ZW8/ref=cm_cr_arp_d_viewopt_sr?ie=UTF8&pageNumber=56&filterByStar=all_stars&sortBy=helpful&reviewerType=all_reviews","Frances McDormand","https://www.amazon.com/gp/customer-reviews/R2O8FHHZA0Q1LW/ref=cm_cr_arp_d_rvw_ttl?ie=UTF8&ASIN=B095322ZW8","https://www.amazon.com/-/en/Frances-McDormand/dp/B095322ZW8/ref=sr_1_4?keywords=nomadland&qid=1664326384&qu=eyJxc2MiOiIyLjQ3IiwicXNhIjoiMi43MSIsInFzcCI6IjEuMjAifQ%3D%3D&sprefix=Nomadla%2Caps%2C285&sr=8-4"
"B095322ZW8","Nomadland (4K UHD)","4.3","866","Lovebugwild33","","Verified Purchase","","","","5.0","March 30, 2022","United States","Watch it. It's like watching a poem visually. It's filmmaking at its highest level. And Francis McDormand is the best actor of this time. This movie will change you. It reaches into your soul and stays in your heart for a while.","","One of the Best Films I have ever seen.","","https://www.amazon.com/gp/profile/amzn1.account.AHKNKGQM2DKR72SQSPPMHZFHX7IQ/ref=cm_cr_arp_d_gw_btm?ie=UTF8","https://www.amazon.com/product-reviews/B095322ZW8/ref=cm_cr_arp_d_viewopt_sr?ie=UTF8&pageNumber=5&filterByStar=all_stars&sortBy=helpful&reviewerType=all_reviews","Frances McDormand","https://www.amazon.com/gp/customer-reviews/R2WNYHOVN2YUAJ/ref=cm_cr_arp_d_rvw_ttl?ie=UTF8&ASIN=B095322ZW8","https://www.amazon.com/-/en/Frances-McDormand/dp/B095322ZW8/ref=sr_1_4?keywords=nomadland&qid=1664326384&qu=eyJxc2MiOiIyLjQ3IiwicXNhIjoiMi43MSIsInFzcCI6IjEuMjAifQ%3D%3D&sprefix=Nomadla%2Caps%2C285&sr=8-4"
"B095322ZW8","Nomadland (4K UHD)","4.3","866","NH Dog Lady","","","","","","5.0","August 30, 2021","United States 🇺🇸","The movie was wonderful, of course, but the books gives a lot more background and information.","","Moving","","https://www.amazon.com/gp/profile/amzn1.account.AFEPEJQZWVEM7MEIMQQUYWIXQ4RA/ref=cm_cr_arp_d_gw_btm?ie=UTF8","https://www.amazon.com/product-reviews/B095322ZW8/ref=cm_cr_arp_d_viewopt_sr?ie=UTF8&pageNumber=71&filterByStar=all_stars&sortBy=helpful&reviewerType=all_reviews","Frances McDormand","https://www.amazon.com/gp/customer-reviews/R3J8ZL0UO489KR/ref=cm_cr_arp_d_rvw_ttl?ie=UTF8&ASIN=B095322ZW8","https://www.amazon.com/-/en/Frances-McDormand/dp/B095322ZW8/ref=sr_1_4?keywords=nomadland&qid=1664326384&qu=eyJxc2MiOiIyLjQ3IiwicXNhIjoiMi43MSIsInFzcCI6IjEuMjAifQ%3D%3D&sprefix=Nomadla%2Caps%2C285&sr=8-4"
"B095322ZW8","Nomadland (4K UHD)","4.3","866","norris","","Verified Purchase","","","","2.0","May 13, 2021","United States","Sooo boring but she was great!!!","","Boring","","https://www.amazon.com/gp/profile/amzn1.account.AGT24OGACKVQ7J4TPVBJL352AR6Q/ref=cm_cr_arp_d_gw_btm?ie=UTF8","https://www.amazon.com/product-reviews/B095322ZW8/ref=cm_cr_arp_d_viewopt_sr?ie=UTF8&pageNumber=58&filterByStar=all_stars&sortBy=helpful&reviewerType=all_reviews","Frances McDormand","https://www.amazon.com/gp/customer-reviews/RKRCOWLK4Q9NC/ref=cm_cr_arp_d_rvw_ttl?ie=UTF8&ASIN=B095322ZW8","https://www.amazon.com/-/en/Frances-McDormand/dp/B095322ZW8/ref=sr_1_4?keywords=nomadland&qid=1664326384&qu=eyJxc2MiOiIyLjQ3IiwicXNhIjoiMi43MSIsInFzcCI6IjEuMjAifQ%3D%3D&sprefix=Nomadla%2Caps%2C285&sr=8-4"
"B095322ZW8","Nomadland (4K UHD)","4.3","866","Michelle Smith","","Verified Purchase","","","","1.0","June 23, 2021","United States","can not download or return purchase","","after purchasing can not download to watch","","https://www.amazon.com/gp/profile/amzn1.account.AHWIDVT3NCWHSWRPCFBNAC3WEGIQ/ref=cm_cr_arp_d_gw_btm?ie=UTF8","https://www.amazon.com/product-reviews/B095322ZW8/ref=cm_cr_arp_d_viewopt_sr?ie=UTF8&pageNumber=66&filterByStar=all_stars&sortBy=helpful&reviewerType=all_reviews","Frances McDormand","https://www.amazon.com/gp/customer-reviews/R3LHZL0XVJFEKW/ref=cm_cr_arp_d_rvw_ttl?ie=UTF8&ASIN=B095322ZW8","https://www.amazon.com/-/en/Frances-McDormand/dp/B095322ZW8/ref=sr_1_4?keywords=nomadland&qid=1664326384&qu=eyJxc2MiOiIyLjQ3IiwicXNhIjoiMi43MSIsInFzcCI6IjEuMjAifQ%3D%3D&sprefix=Nomadla%2Caps%2C285&sr=8-4"
"B095322ZW8","Nomadland (4K UHD)","4.3","866","Miranda Kathrein","","","","","","5.0","May 05, 2021","United States 🇺🇸","I'm finally seeing this one. It won Oscars for Best Picture, Best Actress and Best Director. 💜🎬 I LOVED this movie!!! It is an in depth look at the life of a nomad. It's not an easy lifestyle by any means. The life is very lonely and full of heartache, but there is also so much beauty in it as well. Some people choose that life and some get scarily thrown into it by the downturn of life. I love road trips and being on my own so I have often thought about what it would be like to just live on the road for the rest of my life. There is so much beauty in the world. I think it would be so much nicer to spend your life being one with nature rather than working in a dead end job where you stare at the walls of a cubicle and know what to expect every day for the rest of your life. But there is so much to consider if you do choose that life and I don't quite have the courage and street smarts to pursue it full time. Plus I have never learned to drive and am so petrified of getting behind the wheel so I'm totally out. It's not the life for me. But I certainly am envious of people that have chosen to live this way. As for the ones that don't, my heart just breaks for them. It is really tough out there. I can't even imagine it. This movie was very well done. The screenplay is very good and the acting is so natural. But I think most of the people in this movie are real life nomads and not actors so that explains that. It is a movie, but sort of a documentary as well. I love actress Frances McDormand. She is always amazing. She is natural in whatever role she plays. I wish I could embody the characters as well as she does. I also loved seeing actor David Strathairn in this as well. He is so good and so warm and sweet in this movie. But I think the scenery is what really steals this movie. It is so beautiful. It makes me wish I were on a vacation right now. I am happy that I saw this in theatres. There was only one other person in there with me so it was like having the whole theatre to myself. I loved it! Go see it in theatres if you get a chance or I believe you can also rent it on demand for $5.99. 💜🚙🛤🌄🌅🌌🏞","","The Solitary And Beautiful Life Of A Nomad...","1","https://www.amazon.com/gp/profile/amzn1.account.AEJJ5JOCC4NIOIOZUCYMLJEBFHMQ/ref=cm_cr_arp_d_gw_btm?ie=UTF8","https://www.amazon.com/product-reviews/B095322ZW8/ref=cm_cr_arp_d_viewopt_sr?ie=UTF8&pageNumber=69&filterByStar=all_stars&sortBy=helpful&reviewerType=all_reviews","Frances McDormand","https://www.amazon.com/gp/customer-reviews/RPXYWXVBYLM1T/ref=cm_cr_arp_d_rvw_ttl?ie=UTF8&ASIN=B095322ZW8","https://www.amazon.com/-/en/Frances-McDormand/dp/B095322ZW8/ref=sr_1_4?keywords=nomadland&qid=1664326384&qu=eyJxc2MiOiIyLjQ3IiwicXNhIjoiMi43MSIsInFzcCI6IjEuMjAifQ%3D%3D&sprefix=Nomadla%2Caps%2C285&sr=8-4"
"B095322ZW8","Nomadland (4K UHD)","4.3","866","Retiredrver","","Verified Purchase","","","","5.0","September 24, 2021","United States 🇺🇸","I was a workamper for ten years and knew a lot of the people and locations in the movie. Personally, I lovesd the lifestyle and especially loved working at Amazon each peak season. My favorite Camperforce location is SDF1 in Campbellsville, KY. I think the movie and the book did an excellent job capturing this lifestyle. Only stopped because I wore out my rig and can't afford another one so now it is a tiny house. Good movie!","","Captured the lifestyle!","","https://www.amazon.com/gp/profile/amzn1.account.AHXRTEWNH5VGTE5GJNRPQNCI26EA/ref=cm_cr_arp_d_gw_btm?ie=UTF8","https://www.amazon.com/product-reviews/B095322ZW8/ref=cm_cr_arp_d_viewopt_sr?ie=UTF8&pageNumber=78&filterByStar=all_stars&sortBy=helpful&reviewerType=all_reviews","Frances McDormand","https://www.amazon.com/gp/customer-reviews/RYBS5CUFHE4PE/ref=cm_cr_arp_d_rvw_ttl?ie=UTF8&ASIN=B095322ZW8","https://www.amazon.com/-/en/Frances-McDormand/dp/B095322ZW8/ref=sr_1_4?keywords=nomadland&qid=1664326384&qu=eyJxc2MiOiIyLjQ3IiwicXNhIjoiMi43MSIsInFzcCI6IjEuMjAifQ%3D%3D&sprefix=Nomadla%2Caps%2C285&sr=8-4"
