"asin","product_title","average_rating","total_reviews","review_author","author_badge","badge","reviewed_product_attribute","reviewed_variant_asin","variant_review_url","review_rating","review_date","reviewed_country","review_text","review_comment_count","review_header","no_of_people_reacted_helpful","author_profile_url","url","brand","review_url","input"
"B095322ZW8","Nomadland (4K UHD)","4.3","866","Lana","","","","","","3.0","April 28, 2021","United States 🇺🇸","Watched this a few months ago because it was so highly applauded and am astounded it won the Best Picture and Best Director Oscars. It's not that it's so bad, it's just that it's not that good. Even though the film was education on a lifestyle I wasn't aware of and I felt great affection for the main character, I simply never became engaged. Getting to know Fern and learning about this transient population are about all the film can offer. There was little arc to a storyline that was as flat as the landscapes. It's more like watching a slow, dull documentary, not a dramatic film.","","Not that good","3","https://www.amazon.com/gp/profile/amzn1.account.AEBKGEOQR5QFJOGHYR4RHOPBVGGQ/ref=cm_cr_arp_d_gw_btm?ie=UTF8","https://www.amazon.com/product-reviews/B095322ZW8/ref=cm_cr_arp_d_viewopt_sr?ie=UTF8&pageNumber=71&filterByStar=all_stars&sortBy=helpful&reviewerType=all_reviews","Frances McDormand","https://www.amazon.com/gp/customer-reviews/R1WG0588WS5LIB/ref=cm_cr_arp_d_rvw_ttl?ie=UTF8&ASIN=B095322ZW8","https://www.amazon.com/-/en/Frances-McDormand/dp/B095322ZW8/ref=sr_1_4?keywords=nomadland&qid=1664326384&qu=eyJxc2MiOiIyLjQ3IiwicXNhIjoiMi43MSIsInFzcCI6IjEuMjAifQ%3D%3D&sprefix=Nomadla%2Caps%2C285&sr=8-4"
"B095322ZW8","Nomadland (4K UHD)","4.3","866","Claudia","","Verified Purchase","","","","4.0","August 17, 2021","United States 🇺🇸","Kept wondering if Frances McDormand lived the life as she acted it. Not a feel good movie but worth seeing.","","Seemed more documentary than movie","","https://www.amazon.com/gp/profile/amzn1.account.AFEXSSCBWJ3R2VOXR2H4H2FYXMBA/ref=cm_cr_arp_d_gw_btm?ie=UTF8","https://www.amazon.com/product-reviews/B095322ZW8/ref=cm_cr_arp_d_viewopt_sr?ie=UTF8&pageNumber=10&filterByStar=all_stars&sortBy=helpful&reviewerType=all_reviews","Frances McDormand","https://www.amazon.com/gp/customer-reviews/R4ILP6598E1MQ/ref=cm_cr_arp_d_rvw_ttl?ie=UTF8&ASIN=B095322ZW8","https://www.amazon.com/-/en/Frances-McDormand/dp/B095322ZW8/ref=sr_1_4?keywords=nomadland&qid=1664326384&qu=eyJxc2MiOiIyLjQ3IiwicXNhIjoiMi43MSIsInFzcCI6IjEuMjAifQ%3D%3D&sprefix=Nomadla%2Caps%2C285&sr=8-4"
"B095322ZW8","Nomadland (4K UHD)","4.3","866","Ron Vincent","","","","","","4.0","May 13, 2021","United States 🇺🇸","The Great Recession damaged the lives of many. Nomadland observes the life of Fern and her tribe of Americans who live their lives in vans as a consequence of the economic crash. Frances McDormand delivers a stunning performance where glances and silence convey moods, hurts, and hopes. Fern’s decision to live the nomad life is a choice that drives the film. Many of the camera shots are panoramic art that are a combination of Albert Bierstadt meets Edward Hopper.","","An intimate look at a life lived in a van.","","https://www.amazon.com/gp/profile/amzn1.account.AGIXRGPOBWGSIAPYWLVSGQZRKWTQ/ref=cm_cr_arp_d_gw_btm?ie=UTF8","https://www.amazon.com/product-reviews/B095322ZW8/ref=cm_cr_arp_d_viewopt_sr?ie=UTF8&pageNumber=70&filterByStar=all_stars&sortBy=helpful&reviewerType=all_reviews","Frances McDormand","https://www.amazon.com/gp/customer-reviews/R2NEDW0EXBRC9R/ref=cm_cr_arp_d_rvw_ttl?ie=UTF8&ASIN=B095322ZW8","https://www.amazon.com/-/en/Frances-McDormand/dp/B095322ZW8/ref=sr_1_4?keywords=nomadland&qid=1664326384&qu=eyJxc2MiOiIyLjQ3IiwicXNhIjoiMi43MSIsInFzcCI6IjEuMjAifQ%3D%3D&sprefix=Nomadla%2Caps%2C285&sr=8-4"
"B095322ZW8","Nomadland (4K UHD)","4.3","866","Kathy Harris","","Verified Purchase","","","","4.0","September 14, 2021","United States","Good but a tad artsy for me","","Interesting mivie","1","https://www.amazon.com/gp/profile/amzn1.account.AFIIEERD76E7PSBUOK6IHGXNMEUQ/ref=cm_cr_arp_d_gw_btm?ie=UTF8","https://www.amazon.com/product-reviews/B095322ZW8/ref=cm_cr_arp_d_viewopt_sr?ie=UTF8&pageNumber=11&filterByStar=all_stars&sortBy=helpful&reviewerType=all_reviews","Frances McDormand","https://www.amazon.com/gp/customer-reviews/R32WW77WX6ADMS/ref=cm_cr_arp_d_rvw_ttl?ie=UTF8&ASIN=B095322ZW8","https://www.amazon.com/-/en/Frances-McDormand/dp/B095322ZW8/ref=sr_1_4?keywords=nomadland&qid=1664326384&qu=eyJxc2MiOiIyLjQ3IiwicXNhIjoiMi43MSIsInFzcCI6IjEuMjAifQ%3D%3D&sprefix=Nomadla%2Caps%2C285&sr=8-4"
"B095322ZW8","Nomadland (4K UHD)","4.3","866","Cynthia","","Verified Purchase","","","","5.0","October 14, 2021","United States 🇺🇸","This film is so deep and moving. I love Frances McDormand. I can see how some people would see this movie as really depressing but my husband and I didn’t feel that way at all. I had no idea there was a community of people like this living a nomad life but it makes sense. To me this was a story of resilience and adaptation that was really inspiring. I read that most people in the movie were not actors but actual nomads. The character suffers a devastating life change but still finds a way to connect with a community of people and experience happiness and meaning in her life. She just does what she needs to do in order to survive. She doesn’t complain or blame, she creates a different kind of life for herself. We can all learn something from that.","","Very moving film.","","https://www.amazon.com/gp/profile/amzn1.account.AF655AKXZTCAITAKIT52DNCJ2XVQ/ref=cm_cr_arp_d_gw_btm?ie=UTF8","https://www.amazon.com/product-reviews/B095322ZW8/ref=cm_cr_arp_d_viewopt_sr?ie=UTF8&pageNumber=3&filterByStar=all_stars&sortBy=helpful&reviewerType=all_reviews","Frances McDormand","https://www.amazon.com/gp/customer-reviews/R31CDTRX0OWZMX/ref=cm_cr_arp_d_rvw_ttl?ie=UTF8&ASIN=B095322ZW8","https://www.amazon.com/-/en/Frances-McDormand/dp/B095322ZW8/ref=sr_1_4?keywords=nomadland&qid=1664326384&qu=eyJxc2MiOiIyLjQ3IiwicXNhIjoiMi43MSIsInFzcCI6IjEuMjAifQ%3D%3D&sprefix=Nomadla%2Caps%2C285&sr=8-4"
"B095322ZW8","Nomadland (4K UHD)","4.3","866","Asiago","","Verified Purchase","","","","4.0","August 20, 2021","United States 🇺🇸","The book was a run down on how Amazon works and some side story. The movie was the story.","","Rare. The movie is better than the book","","https://www.amazon.com/gp/profile/amzn1.account.AEA27AY7BUZP2C3CCTBK4AFY65ZQ/ref=cm_cr_arp_d_gw_btm?ie=UTF8","https://www.amazon.com/product-reviews/B095322ZW8/ref=cm_cr_arp_d_viewopt_sr?ie=UTF8&pageNumber=81&filterByStar=all_stars&sortBy=helpful&reviewerType=all_reviews","Frances McDormand","https://www.amazon.com/gp/customer-reviews/RY7YBRY9PG9GO/ref=cm_cr_arp_d_rvw_ttl?ie=UTF8&ASIN=B095322ZW8","https://www.amazon.com/-/en/Frances-McDormand/dp/B095322ZW8/ref=sr_1_4?keywords=nomadland&qid=1664326384&qu=eyJxc2MiOiIyLjQ3IiwicXNhIjoiMi43MSIsInFzcCI6IjEuMjAifQ%3D%3D&sprefix=Nomadla%2Caps%2C285&sr=8-4"
"B095322ZW8","Nomadland (4K UHD)","4.3","866","FUN*RUNNER","","Verified Purchase","","","","5.0","August 02, 2021","United States","Pretty disturbing, but the depth and realistic feel were knitted in and painted a brilliant picture of what it's like to be ""on the road"" as a lifestyle.","","Loved it....","","https://www.amazon.com/gp/profile/amzn1.account.AE6N4CARXGCB2FJESJWSEMNWOJCA/ref=cm_cr_arp_d_gw_btm?ie=UTF8","https://www.amazon.com/product-reviews/B095322ZW8/ref=cm_cr_arp_d_viewopt_sr?ie=UTF8&pageNumber=83&filterByStar=all_stars&sortBy=helpful&reviewerType=all_reviews","Frances McDormand","https://www.amazon.com/gp/customer-reviews/R1JU78RVJJDZRW/ref=cm_cr_arp_d_rvw_ttl?ie=UTF8&ASIN=B095322ZW8","https://www.amazon.com/-/en/Frances-McDormand/dp/B095322ZW8/ref=sr_1_4?keywords=nomadland&qid=1664326384&qu=eyJxc2MiOiIyLjQ3IiwicXNhIjoiMi43MSIsInFzcCI6IjEuMjAifQ%3D%3D&sprefix=Nomadla%2Caps%2C285&sr=8-4"
"B095322ZW8","Nomadland (4K UHD)","4.3","866","dtlkg","","Verified Purchase","","","","1.0","May 05, 2021","United States 🇺🇸","Was hoping for an expose of the collapse of the social / economic network for people on limited social security etc. Something to really make you think. Instead it was just a PAINFULLY dark and slow moving look into the depressing details of a woman. This movie made me feel nothing but depressed and confused - what was the point of the movie? what was it trying to say? I'm not a dense person - but neither me or my partner found anything even remotely interesting or compelling in the entire movie. I can't understand why this is popular. We started at half way mark checking the time stamp over and over to see how much longer we had to endure this dark, plotless, ""go nowhere character"". It felt interminable.","","painful to watch and not in a good way","5","https://www.amazon.com/gp/profile/amzn1.account.AHW47QOUL6QWAO3342DV2V2G2N2Q/ref=cm_cr_arp_d_gw_btm?ie=UTF8","https://www.amazon.com/product-reviews/B095322ZW8/ref=cm_cr_arp_d_viewopt_sr?ie=UTF8&pageNumber=43&filterByStar=all_stars&sortBy=helpful&reviewerType=all_reviews","Frances McDormand","https://www.amazon.com/gp/customer-reviews/R1P9LMQ12U34Q2/ref=cm_cr_arp_d_rvw_ttl?ie=UTF8&ASIN=B095322ZW8","https://www.amazon.com/-/en/Frances-McDormand/dp/B095322ZW8/ref=sr_1_4?keywords=nomadland&qid=1664326384&qu=eyJxc2MiOiIyLjQ3IiwicXNhIjoiMi43MSIsInFzcCI6IjEuMjAifQ%3D%3D&sprefix=Nomadla%2Caps%2C285&sr=8-4"
"B095322ZW8","Nomadland (4K UHD)","4.3","866","Joseph OBrien","","Verified Purchase","","","","3.0","July 06, 2021","United States 🇺🇸","I was hoping that at some point Fern would beat her depression and realize that the van life was a renewed source of joy. Why did so many friends want to be around such a soul sucker who couldn't move on or do anything about her depression. This was a fantastic depiction of the Rubber Tramp Rendezvous in Arizona. Folks there are the most loving and welcoming people you can ever meet. The old man, Bob Wells, has transformed many thousand broken lives. Fern went through the motions of breaking her depression, but never beat it. At one point she defended van live in words, but still was just trying to espouse what the other van people wholeheartedly embraced.","","Crushed and broken","2","https://www.amazon.com/gp/profile/amzn1.account.AHY7UCDE6YJP2WMPNC227JU7UQDQ/ref=cm_cr_arp_d_gw_btm?ie=UTF8","https://www.amazon.com/product-reviews/B095322ZW8/ref=cm_cr_arp_d_viewopt_sr?ie=UTF8&pageNumber=8&filterByStar=all_stars&sortBy=helpful&reviewerType=all_reviews","Frances McDormand","https://www.amazon.com/gp/customer-reviews/R3OS0FZKPJT5MN/ref=cm_cr_arp_d_rvw_ttl?ie=UTF8&ASIN=B095322ZW8","https://www.amazon.com/-/en/Frances-McDormand/dp/B095322ZW8/ref=sr_1_4?keywords=nomadland&qid=1664326384&qu=eyJxc2MiOiIyLjQ3IiwicXNhIjoiMi43MSIsInFzcCI6IjEuMjAifQ%3D%3D&sprefix=Nomadla%2Caps%2C285&sr=8-4"
"B095322ZW8","Nomadland (4K UHD)","4.3","866","Jaan Vendla","","Verified Purchase","","","","5.0","November 28, 2021","United States 🇺🇸","The best movie of all time!","","The best movie of all time!","","https://www.amazon.com/gp/profile/amzn1.account.AF2ZLYDBTINZJCFOV5V6VMBIDJBA/ref=cm_cr_arp_d_gw_btm?ie=UTF8","https://www.amazon.com/product-reviews/B095322ZW8/ref=cm_cr_arp_d_viewopt_sr?ie=UTF8&pageNumber=25&filterByStar=all_stars&sortBy=helpful&reviewerType=all_reviews","Frances McDormand","https://www.amazon.com/gp/customer-reviews/R28XCCTVAB7R3C/ref=cm_cr_arp_d_rvw_ttl?ie=UTF8&ASIN=B095322ZW8","https://www.amazon.com/-/en/Frances-McDormand/dp/B095322ZW8/ref=sr_1_4?keywords=nomadland&qid=1664326384&qu=eyJxc2MiOiIyLjQ3IiwicXNhIjoiMi43MSIsInFzcCI6IjEuMjAifQ%3D%3D&sprefix=Nomadla%2Caps%2C285&sr=8-4"
"B095322ZW8","Nomadland (4K UHD)","4.3","866","Larry Yates","","Verified Purchase","","","","5.0","August 07, 2021","United States 🇺🇸","I liked it.","","Interesting film.","","https://www.amazon.com/gp/profile/amzn1.account.AH6BEWOD3CC7VQYKLL6R3GY45Y4A/ref=cm_cr_arp_d_gw_btm?ie=UTF8","https://www.amazon.com/product-reviews/B095322ZW8/ref=cm_cr_arp_d_viewopt_sr?ie=UTF8&pageNumber=43&filterByStar=all_stars&sortBy=helpful&reviewerType=all_reviews","Frances McDormand","https://www.amazon.com/gp/customer-reviews/R159OLR1VAKB0I/ref=cm_cr_arp_d_rvw_ttl?ie=UTF8&ASIN=B095322ZW8","https://www.amazon.com/-/en/Frances-McDormand/dp/B095322ZW8/ref=sr_1_4?keywords=nomadland&qid=1664326384&qu=eyJxc2MiOiIyLjQ3IiwicXNhIjoiMi43MSIsInFzcCI6IjEuMjAifQ%3D%3D&sprefix=Nomadla%2Caps%2C285&sr=8-4"
"B095322ZW8","Nomadland (4K UHD)","4.3","866","CBF","","Verified Purchase","","","","4.0","October 21, 2021","Germany","Nachdem ihr Mann gestorben ist, reist die 60-jährige Fern als Nomadin mit ihrem Van durch die USA. Zwischendurch nimmt sie Jobs an und lernt außerdem viele Menschen kennen, die ebenfalls als Nomaden durch die USA unterwegs sind. Der Film ist eine Adaption des Sachbuchs „Nomaden der Arbeit: Überleben in den USA im 21. Jahrhundert.“ Der Film ist quasi eine Art Roadmovie, welcher uns einen Einblick in das Nomadenleben in den USA gewährt. Die Nomaden sind unter anderem inspiriert vom Bob Wells, welcher einen Youtube Kanal über nomadischen Lebensstil und „vandwelling“ macht. Dieser Bob Wells spielt übrigens in dem Film sich selbst. Was uns auch schon direkt zum nächsten Punkt führt: Den Darstellern. Die meisten „Darsteller“ spielen tatsächlich sich selbst, bzw. eine fiktive Version von sich selbst. Die professionell besetzten Rollen sind eher in der Minderheit. Dies tut der augenscheinlichen Authentizität auch ziemlich gut, denn die ganzen Nebencharaktere kommen ziemlich glaubwürdig und interessant rüber. Tatsächlich würde ich gerade diese Darsteller als Schauspielerisches Highlight des Filmes nennen, ich persönlich fand die Nebendarsteller authentischer und auch interessanter als der eigentliche Hauptcharakter. Interessant finde ich auch zu erwähnen, dass die Regisseurin selbst auf einen Roadtrip begab um die Community – und auch den Lebensstil besser kennen zu lernen. Zur augenscheinlichen Authentizität – der Film wirkte auf mich glaubwürdig in der Darstellung und hat gut darin getan, dem Zuschauer einen Einblick – in eine für die meisten – ungewöhnliche Realität zu gewähren – die für viele vermutlich heute so gar nicht vorstellbar ist, aber durchaus existiert. Aber ich habe mich mit der Thematik selbst nicht ausführlich beschäftigt und habe selbst noch keine Nomaden kennen gelernt, oder versucht so zu leben. Von daher kann ich natürlich keine Aussage darüber treffen, in wie fern der Film nun das Leben dieser Menschen authentisch darstellt oder nicht – aber es wirkte zumindest so. Wunderschön ist auch die Ästhetik des Filmes, schöne Bilder. Mit einer tollen Kameraführung, die exzellent mit der großartigen Musik von Ludovico Einaudi harmoniert. Insgesamt finde ich den Film gut und würde ihn mit 3,5 Sternen bewerten – warum? Das kann ich gar nicht so genau sagen und es gibt auch keine offensichtlichen Schwächen, aber der Film hat mich jetzt nicht so sehr begeistert, dass ich eine höhere Bewertung rechtfertigen könnte, oder die Oscar Auszeichnung als „bester Film“ nachvollziehen könnte. Insgesamt ein sehr interessanter, ästhetischer Film, aber meines Erachtens auch nicht einer der besten Filme aller Zeiten.","","Tomorrow, and tomorrow, and tomorrow. And all of our yesterdays have lighted fools.","2","","https://www.amazon.com/product-reviews/B095322ZW8/ref=cm_cr_arp_d_viewopt_sr?ie=UTF8&pageNumber=84&filterByStar=all_stars&sortBy=helpful&reviewerType=all_reviews","Frances McDormand","","https://www.amazon.com/-/en/Frances-McDormand/dp/B095322ZW8/ref=sr_1_4?keywords=nomadland&qid=1664326384&qu=eyJxc2MiOiIyLjQ3IiwicXNhIjoiMi43MSIsInFzcCI6IjEuMjAifQ%3D%3D&sprefix=Nomadla%2Caps%2C285&sr=8-4"
"B095322ZW8","Nomadland (4K UHD)","4.3","866","Adolf Galland","","Verified Purchase","","","","5.0","August 08, 2021","Italy 🇮🇹","Tanto imperdibile quanto istruttivo. Un film che lascerà il suo segno nel tempo. Ancora più efficace se accompagnato dalla lettura dell'omonimo libro-inchiesta di Jessica Bruder, che ha ispirato il film. L'America che ne esce non è certo quella che abbiamo in mente","","Imperdibile","","","https://www.amazon.com/product-reviews/B095322ZW8/ref=cm_cr_arp_d_viewopt_sr?ie=UTF8&pageNumber=86&filterByStar=all_stars&sortBy=helpful&reviewerType=all_reviews","Frances McDormand","","https://www.amazon.com/-/en/Frances-McDormand/dp/B095322ZW8/ref=sr_1_4?keywords=nomadland&qid=1664326384&qu=eyJxc2MiOiIyLjQ3IiwicXNhIjoiMi43MSIsInFzcCI6IjEuMjAifQ%3D%3D&sprefix=Nomadla%2Caps%2C285&sr=8-4"
"B095322ZW8","Nomadland (4K UHD)","4.3","866","Mike","","Verified Purchase","","","","5.0","June 02, 2021","United States","We enjoyed watching this movie","","fun","","https://www.amazon.com/gp/profile/amzn1.account.AF7JTKISHH73JSL7FA3AUKAYJS2Q/ref=cm_cr_arp_d_gw_btm?ie=UTF8","https://www.amazon.com/product-reviews/B095322ZW8/ref=cm_cr_arp_d_viewopt_sr?ie=UTF8&pageNumber=46&filterByStar=all_stars&sortBy=helpful&reviewerType=all_reviews","Frances McDormand","https://www.amazon.com/gp/customer-reviews/R106LDC9JQA57/ref=cm_cr_arp_d_rvw_ttl?ie=UTF8&ASIN=B095322ZW8","https://www.amazon.com/-/en/Frances-McDormand/dp/B095322ZW8/ref=sr_1_4?keywords=nomadland&qid=1664326384&qu=eyJxc2MiOiIyLjQ3IiwicXNhIjoiMi43MSIsInFzcCI6IjEuMjAifQ%3D%3D&sprefix=Nomadla%2Caps%2C285&sr=8-4"
"B095322ZW8","Nomadland (4K UHD)","4.3","866","Susanne","","Verified Purchase","","","","5.0","January 03, 2022","United States 🇺🇸","Loved this movie","","Great","","https://www.amazon.com/gp/profile/amzn1.account.AGVJ243G4TBMIMUZT7C6ZMYK6XDQ/ref=cm_cr_arp_d_gw_btm?ie=UTF8","https://www.amazon.com/product-reviews/B095322ZW8/ref=cm_cr_arp_d_viewopt_sr?ie=UTF8&pageNumber=23&filterByStar=all_stars&sortBy=helpful&reviewerType=all_reviews","Frances McDormand","https://www.amazon.com/gp/customer-reviews/R242C0L89UAWBS/ref=cm_cr_arp_d_rvw_ttl?ie=UTF8&ASIN=B095322ZW8","https://www.amazon.com/-/en/Frances-McDormand/dp/B095322ZW8/ref=sr_1_4?keywords=nomadland&qid=1664326384&qu=eyJxc2MiOiIyLjQ3IiwicXNhIjoiMi43MSIsInFzcCI6IjEuMjAifQ%3D%3D&sprefix=Nomadla%2Caps%2C285&sr=8-4"
"B095322ZW8","Nomadland (4K UHD)","4.3","866","PhilR","","Verified Purchase","","","","5.0","September 07, 2021","United States","This movie hits on all levels. The main character was forced into a life on the road when the town she lived in died economically and her husband died the previous year. She was traveling the highways alone in her van, stopping briefly in places to work and then moving on. This movie showcased the simple, isolated, and lonely life on the road and the interesting people she encountered. Is this what happens when one becomes homeless and has to live on the open road? This woman is a survivor and shows us that living life on the road can not only be good, but very healing to the soul as well.","","Simple but deep","","https://www.amazon.com/gp/profile/amzn1.account.AEKRQ3MD7JNX4CDK3XW3I4HHVOBQ/ref=cm_cr_arp_d_gw_btm?ie=UTF8","https://www.amazon.com/product-reviews/B095322ZW8/ref=cm_cr_arp_d_viewopt_sr?ie=UTF8&pageNumber=5&filterByStar=all_stars&sortBy=helpful&reviewerType=all_reviews","Frances McDormand","https://www.amazon.com/gp/customer-reviews/RJP5CWQ2N7Y99/ref=cm_cr_arp_d_rvw_ttl?ie=UTF8&ASIN=B095322ZW8","https://www.amazon.com/-/en/Frances-McDormand/dp/B095322ZW8/ref=sr_1_4?keywords=nomadland&qid=1664326384&qu=eyJxc2MiOiIyLjQ3IiwicXNhIjoiMi43MSIsInFzcCI6IjEuMjAifQ%3D%3D&sprefix=Nomadla%2Caps%2C285&sr=8-4"
"B095322ZW8","Nomadland (4K UHD)","4.3","866","Linda Terrell Kidzbooks","","Verified Purchase","","","","1.0","April 28, 2021","United States","Boring, and just overall depressing....and this won an oscar?!‽!","","BORING!!!","9","https://www.amazon.com/gp/profile/amzn1.account.AENNCZWNK5QSG2VSX3OFNSGVJTNQ/ref=cm_cr_arp_d_gw_btm?ie=UTF8","https://www.amazon.com/product-reviews/B095322ZW8/ref=cm_cr_arp_d_viewopt_sr?ie=UTF8&pageNumber=66&filterByStar=all_stars&sortBy=helpful&reviewerType=all_reviews","Frances McDormand","https://www.amazon.com/gp/customer-reviews/R17KC3OC14UMZN/ref=cm_cr_arp_d_rvw_ttl?ie=UTF8&ASIN=B095322ZW8","https://www.amazon.com/-/en/Frances-McDormand/dp/B095322ZW8/ref=sr_1_4?keywords=nomadland&qid=1664326384&qu=eyJxc2MiOiIyLjQ3IiwicXNhIjoiMi43MSIsInFzcCI6IjEuMjAifQ%3D%3D&sprefix=Nomadla%2Caps%2C285&sr=8-4"
"B095322ZW8","Nomadland (4K UHD)","4.3","866","Robb Severdia","","Verified Purchase","","","","5.0","June 25, 2021","United States","I know that this movie is true, it is just too real life depressing for me.4","","Depressing","","https://www.amazon.com/gp/profile/amzn1.account.AEMPVOPJO5MMBHFZLEJMJJN7EG2A/ref=cm_cr_arp_d_gw_btm?ie=UTF8","https://www.amazon.com/product-reviews/B095322ZW8/ref=cm_cr_arp_d_viewopt_sr?ie=UTF8&pageNumber=37&filterByStar=all_stars&sortBy=helpful&reviewerType=all_reviews","Frances McDormand","https://www.amazon.com/gp/customer-reviews/R1ON1F6M6ILW6H/ref=cm_cr_arp_d_rvw_ttl?ie=UTF8&ASIN=B095322ZW8","https://www.amazon.com/-/en/Frances-McDormand/dp/B095322ZW8/ref=sr_1_4?keywords=nomadland&qid=1664326384&qu=eyJxc2MiOiIyLjQ3IiwicXNhIjoiMi43MSIsInFzcCI6IjEuMjAifQ%3D%3D&sprefix=Nomadla%2Caps%2C285&sr=8-4"
"B095322ZW8","Nomadland (4K UHD)","4.3","866","Angela M. Hey","VINE VOICE","Verified Purchase","","","","5.0","July 06, 2021","United States 🇺🇸","This movie gives insights into what it is like living in a camper van and the types of characters one might meet should you venture into this lifestyle. It is well-done with credible characters.","","Insights into characters found on camper van sites","","https://www.amazon.com/gp/profile/amzn1.account.AH3JZKIO4HEGNSII2VUODU52ZWJA/ref=cm_cr_arp_d_gw_btm?ie=UTF8","https://www.amazon.com/product-reviews/B095322ZW8/ref=cm_cr_arp_d_viewopt_sr?ie=UTF8&pageNumber=23&filterByStar=all_stars&sortBy=helpful&reviewerType=all_reviews","Frances McDormand","https://www.amazon.com/gp/customer-reviews/R3ME45FS424A68/ref=cm_cr_arp_d_rvw_ttl?ie=UTF8&ASIN=B095322ZW8","https://www.amazon.com/-/en/Frances-McDormand/dp/B095322ZW8/ref=sr_1_4?keywords=nomadland&qid=1664326384&qu=eyJxc2MiOiIyLjQ3IiwicXNhIjoiMi43MSIsInFzcCI6IjEuMjAifQ%3D%3D&sprefix=Nomadla%2Caps%2C285&sr=8-4"
"B095322ZW8","Nomadland (4K UHD)","4.3","866","Tina","","Verified Purchase","","","","2.0","May 13, 2021","United States","She was a great actress , but it was pretty dark and depressing to me","","Great actress","","https://www.amazon.com/gp/profile/amzn1.account.AFABG4DC62CEKA5O7X5SKPAPWIFA/ref=cm_cr_arp_d_gw_btm?ie=UTF8","https://www.amazon.com/product-reviews/B095322ZW8/ref=cm_cr_arp_d_viewopt_sr?ie=UTF8&pageNumber=54&filterByStar=all_stars&sortBy=helpful&reviewerType=all_reviews","Frances McDormand","https://www.amazon.com/gp/customer-reviews/R3K3T55JNWF6OL/ref=cm_cr_arp_d_rvw_ttl?ie=UTF8&ASIN=B095322ZW8","https://www.amazon.com/-/en/Frances-McDormand/dp/B095322ZW8/ref=sr_1_4?keywords=nomadland&qid=1664326384&qu=eyJxc2MiOiIyLjQ3IiwicXNhIjoiMi43MSIsInFzcCI6IjEuMjAifQ%3D%3D&sprefix=Nomadla%2Caps%2C285&sr=8-4"
"B095322ZW8","Nomadland (4K UHD)","4.3","866","Plant Doctor","","","","","","2.0","April 12, 2021","United States","A very disappointing version of an interesting and disturbing book. Too much dead space watching characters walk, stare etc when we should have been invited into thoughts and interactions. Dull.","","Dull. Missed the substance of the book","17","https://www.amazon.com/gp/profile/amzn1.account.AFQIGKUIK3MVCFLYAG2ZIIQI5VVQ/ref=cm_cr_arp_d_gw_btm?ie=UTF8","https://www.amazon.com/product-reviews/B095322ZW8/ref=cm_cr_arp_d_viewopt_sr?ie=UTF8&pageNumber=74&filterByStar=all_stars&sortBy=helpful&reviewerType=all_reviews","Frances McDormand","https://www.amazon.com/gp/customer-reviews/R392K0LHISQFC3/ref=cm_cr_arp_d_rvw_ttl?ie=UTF8&ASIN=B095322ZW8","https://www.amazon.com/-/en/Frances-McDormand/dp/B095322ZW8/ref=sr_1_4?keywords=nomadland&qid=1664326384&qu=eyJxc2MiOiIyLjQ3IiwicXNhIjoiMi43MSIsInFzcCI6IjEuMjAifQ%3D%3D&sprefix=Nomadla%2Caps%2C285&sr=8-4"
"B095322ZW8","Nomadland (4K UHD)","4.3","866","April M. Roth","","Verified Purchase","","","","5.0","May 09, 2021","United States","Really different perspective at life and what’s important.","","Different and interesting","1","https://www.amazon.com/gp/profile/amzn1.account.AF2DNLREZYJMPYGX2O6AP7RI75WA/ref=cm_cr_arp_d_gw_btm?ie=UTF8","https://www.amazon.com/product-reviews/B095322ZW8/ref=cm_cr_arp_d_viewopt_sr?ie=UTF8&pageNumber=46&filterByStar=all_stars&sortBy=helpful&reviewerType=all_reviews","Frances McDormand","https://www.amazon.com/gp/customer-reviews/R2FKG10ITS6CK0/ref=cm_cr_arp_d_rvw_ttl?ie=UTF8&ASIN=B095322ZW8","https://www.amazon.com/-/en/Frances-McDormand/dp/B095322ZW8/ref=sr_1_4?keywords=nomadland&qid=1664326384&qu=eyJxc2MiOiIyLjQ3IiwicXNhIjoiMi43MSIsInFzcCI6IjEuMjAifQ%3D%3D&sprefix=Nomadla%2Caps%2C285&sr=8-4"
"B095322ZW8","Nomadland (4K UHD)","4.3","866","Roz","","Verified Purchase","","","","5.0","May 29, 2021","United States 🇺🇸","Great film, difficult subjects brought to life","","A must see film","1","https://www.amazon.com/gp/profile/amzn1.account.AG7CGMIB4BPLM2VX2J4GRBQCKRDQ/ref=cm_cr_arp_d_gw_btm?ie=UTF8","https://www.amazon.com/product-reviews/B095322ZW8/ref=cm_cr_arp_d_viewopt_sr?ie=UTF8&pageNumber=45&filterByStar=all_stars&sortBy=helpful&reviewerType=all_reviews","Frances McDormand","https://www.amazon.com/gp/customer-reviews/R16BWCF8X48Z9B/ref=cm_cr_arp_d_rvw_ttl?ie=UTF8&ASIN=B095322ZW8","https://www.amazon.com/-/en/Frances-McDormand/dp/B095322ZW8/ref=sr_1_4?keywords=nomadland&qid=1664326384&qu=eyJxc2MiOiIyLjQ3IiwicXNhIjoiMi43MSIsInFzcCI6IjEuMjAifQ%3D%3D&sprefix=Nomadla%2Caps%2C285&sr=8-4"
